context,description,mentioned_groups
B60,"vehicles in general; vehicle wheels ; castors; axles for wheels or castors; increasing wheel adhesion; vehicle tyres; tyre inflation; tyre changing; connecting valves to inflatable elastic bodies in general; devices or arrangements related to tyres; vehicle connections ; vehicles for use both on rail and on road; amphibious or like vehicles; convertible vehicles ; vehicle suspension arrangements ); arrangements of heating, cooling, ventilating or other air-treating devices specially adapted for passenger or goods spaces of vehicles; windows, windscreens, non-fixed roofs, doors, or similar devices for vehicles; removable external protective coverings specially adapted for vehicles ; arrangement or mounting of propulsion units or of transmissions in vehicles; arrangement or mounting of plural diverse prime-movers in vehicles; auxiliary drives for vehicles; instrumentation or dashboards for vehicles; arrangements in connection with cooling, air intake, gas exhaust or fuel supply of propulsion units in vehicles; propulsion of electrically-propelled vehicles ; supplying electric power for auxiliary equipment of electrically-propelled vehicles ; electrodynamic brake systems for vehicles in general ; magnetic suspension or levitation for vehicles; monitoring operating variables of electrically-propelled vehicles; electric safety devices for electrically-propelled vehicles; power supply lines, and devices along rails, for electrically- propelled vehicles ; seats specially adapted for vehicles; vehicle passenger accommodation not otherwise provided for; vehicles adapted for load transportation or to transport, to carry, or to comprise special loads or objects ; arrangement of signalling or lighting devices, the mounting or supporting thereof or circuits therefor, for vehicles in general; vehicles, vehicle fittings, or vehicle parts, not otherwise provided for; servicing, cleaning, repairing, supporting, lifting, or manoeuvring of vehicles, not otherwise provided for; vehicle brake control systems or parts thereof; brake control systems or parts thereof, in general ; arrangement of braking elements on vehicles in general; portable devices for preventing unwanted movement of vehicles; vehicle modifications to facilitate cooling of brakes; air-cushion vehicles; conjoint control of vehicle sub-units of different type or different function; control systems specially adapted for hybrid vehicles; road vehicle drive control systems for purposes not related to the control of a particular sub-unit; indexing scheme relating to aspects cross-cutting vehicle technology","{'E05', 'A61', 'B61', 'H02', 'B60', 'B62', 'E01', 'B21', 'F16'}"
B61,"railways; railway systems; equipment therefor not otherwise provided for ; locomotives; motor railcars ; body details or kinds of railway vehicles ; rail vehicle suspensions, e.g. underframes, bogies or arrangements of wheel axles; rail vehicles for use on tracks of different width; preventing derailing of rail vehicles; wheel guards, obstruction removers or the like for rail vehicles ; couplings; draught and buffing appliances ; brakes or other retarding devices specially adapted for rail vehicles; arrangement or disposition thereof in rail vehicles ; shifting or shunting of rail vehicles ; auxiliary equipment specially adapted for railways, not otherwise provided for ; guiding railway traffic; ensuring the safety of railway traffic ","{'B61', 'H02', 'B60', 'H04', 'G05', 'E01', 'B66', 'F16', 'G02'}"
B62,"land vehicles for travelling otherwise than on rails; hand-propelled vehicles, e.g. hand carts or perambulators; sledges ; vehicles drawn by animals; motor vehicles; trailers ; cycle stands; supports or holders for parking or storing cycles; appliances preventing or indicating unauthorized use or theft of cycles; locks integral with cycles; devices for learning to ride cycles; cycle saddles or seats; auxiliary devices or accessories specially adapted to cycles and not otherwise provided for, e.g. article carriers or cycle protectors; cycles; cycle frames; cycle steering devices; rider-operated terminal controls specially adapted for cycles; cycle axle suspensions; cycle side-cars, forecars, or the like; brakes specially adapted for cycles }; rider propulsion of wheeled vehicles or sledges; powered propulsion of sledges or  cycles; transmissions specially adapted for such vehicles ","{'F16', 'B60', 'G01', 'A01', 'B62'}"
B63,"ships or other waterborne vessels; related equipment; ships or other waterborne vessels; equipment for shipping  ; launching, hauling-out, or dry-docking of vessels; life-saving in water; equipment for dwelling or working under water; means for salvaging or searching for underwater objects ; offensive or defensive arrangements on vessels; mine-laying; mine-sweeping; submarines; aircraft carriers ; marine propulsion or steering ; auxiliaries on vessels","{'F41', 'F42', 'B63', 'E02', 'B60'}"
B64,"aircraft; aviation; cosmonautics; lighter-than air aircraft; aeroplanes; helicopters ; equipment for fitting in or to aircraft; flying suits; parachutes; arrangements or mounting of power plants or propulsion transmissions in aircraft; ground or aircraft-carrier-deck installations specially adapted for use in connection with aircraft; designing, manufacturing, assembling, cleaning, maintaining or repairing aircraft, not otherwise provided for; handling, transporting, testing or inspecting aircraft components, not otherwise provided for; cosmonautics; vehicles or equipment therefor ","{'B60', 'E21'}"
B65,"conveying; packing; storing; handling thin or filamentary material; machines, apparatus or devices for, or methods of, packaging articles or materials; unpacking ; labelling or tagging machines, apparatus, or processes }; containers for storage or transport of articles or materials, e.g. bags, barrels, bottles, boxes, cans, cartons, crates, drums, jars, tanks, hoppers, forwarding containers; accessories, closures, or fittings therefor; packaging elements; packages; gathering or removal of domestic or like refuse ); transport or storage devices, e.g. conveyors for loading or tipping, shop conveyor systems or pneumatic tube conveyors ; handling thin or filamentary material, e.g. sheets, webs, cables","{'E03', 'G09', 'A61', 'B07', 'B03', 'B41', 'A24', 'B02', 'B27', 'B66', 'B67', 'F23', 'F17', 'B25', 'C10', 'B62', 'E04', 'C05', 'B65'}"
B66,"hoisting; lifting; hauling; elevators; escalators or moving walkways  ; funicular railbound systems with rigid ground-supported tracks and cable traction, e.g. cliff railways, b61b 9/00; arrangements of ammunition handlers in vessels b63g 3/00; hoists, lifts, or conveyors for loading or unloading in general b65g; braking or detent devices controlling normal movements of winding drums or barrels b66d; ship-lifting devices e02c; garages for many vehicles with mechanical means for lifting vehicles e04h 6/12; hoists for feeding ammunition or projectiles to launching apparatus or to loading mechanisms f41a 9/00); cranes; load-engaging elements or devices for cranes, capstans, winches, or tackles  rope, cable, or chain winding mechanisms, braking or detent devices therefor b66d; specially adapted for nuclear reactors g21); capstans; winches; tackles, e.g. pulley blocks; hoists ; hoisting, lifting, hauling or pushing, not otherwise provided for, e.g. devices which apply a lifting or pushing force directly to the surface of a load  mounting artificial islands on piles or like supports e02b 17/00 : scaffolding combined with lifting devices e04g 1/22; lifting devices for sliding forms e04g 11/24; lifting of buildings e04g 23/06; shores or struts e04g 25/00; lifts or other hoisting devices on ladders e06c 7/12; props for mining e21d 15/00)","{'A61', 'B61', 'A63', 'G21', 'E06', 'E02', 'B65', 'F41', 'E04', 'B63', 'B66', 'E21'}"
B67,"opening, closing  bottles, jars or similar containers; liquid handling; applying closure members to bottles jars, or similar containers; opening closed containers ; cleaning, filling with liquids or semiliquids, or emptying, of bottles, jars, cans, casks, barrels, or similar containers, not otherwise provided for; funnels; dispensing, delivering or transferring liquids, not otherwise provided for ","{'E03', 'F17', 'G07', 'B08', 'F24', 'B65', 'B67', 'G01'}"
B68,"saddlery; upholstery; harness; devices used in connection therewith; whips or the like; saddles; stirrups; making articles from leather, canvas, or the like; methods, equipment, or machines for use in upholstering; upholstery not otherwise provided for",set()
B81,"microstructural technology; microstructural devices or systems, e.g. micromechanical devices ; processes or apparatus specially adapted for the manufacture or treatment of microstructural devices or systems ","{'H01', 'B01'}"
B82,"nanotechnology; nanostructures formed by manipulation of individual atoms, molecules, or limited collections of atoms or molecules as discrete units; manufacture or treatment thereof; specific uses or applications of nanostructures; measurement or analysis of nanostructures; manufacture or treatment of nanostructures",set()
B99,subject matter not otherwise provided for in this section; subject matter not otherwise provided for in this section,set()
C01,"inorganic chemistry; non-metallic elements; compounds thereof; ; ammonia; cyanogen; compounds thereof ; salts of oxyacids of halogens c01b 11/00; peroxides, salts of peroxyacids c01b 15/00; thiosulfates, dithionites, polythionates c01b 17/64; compounds containing selenium or tellurium c01b 19/00; azides c01b 21/08; ; metal imides or amides c01b 21/092; nitrites c01b 21/50; ; phosphides c01b 25/08; salts of oxyacids of phosphorus c01b 25/16; compounds containing silicon c01b 33/00; compounds containing boron c01b 35/00); compounds of alkali metals, i.e. lithium, sodium, potassium, rubidium, caesium, or francium  c01b 6/00; salts of oxyacids of halogens c01b 11/00; peroxides, salts of peroxyacids c01b 15/00; sulfides c01b 17/22; thiosulfates, dithionites, polythionates c01b 17/64; compounds containing selenium or tellurium c01b 19/00; binary compounds of nitrogen with metals c01b 21/06; azides c01b 21/08; ; metal amides c01b 21/092; nitrites c01b 21/50; phosphides c01b 21/50; ; phosphides c01b 25/08; salts of oxyacids of phosphorus c01b 25/16; carbides c01b 32/90; compounds containing silicon c01b 33/00; compounds containing boron c01b 35/00; cyanides c01c 3/08; salts of cyanic acid c01c 3/14; salts of cyanamide c01c 3/16; thiocyanates c01c 3/20); compounds of the metals beryllium, magnesium, aluminium, calcium, strontium, barium, radium, thorium, or of the rare-earth metals  c01b 6/00; salts of oxyacids of halogens c01b 11/00; peroxides, salts of peroxyacids c01b 15/00; sulfides or polysulfides of magnesium, calcium, strontium, or barium c01b 17/42; thiosulfates, dithionites, polythionates c01b 17/64; compounds containing selenium or tellurium c01b 19/00; binary compounds of nitrogen with metals c01b 21/06; azides c01b 21/08; ; metal  amides c01b 21/092, ; nitrites c01b 21/50; ; phosphides c01b 25/08; salts of oxyacids of phosphorus c01b 25/16; carbides c01b 32/90; compounds containing silicon c01b 33/00; compounds containing boron c01b 35/00; compounds having molecular sieve properties but not having base-exchange properties c01b 37/00; compounds having molecular sieve and base-exchange properties, e.g. crystalline zeolites, c01b 39/00; cyanides c01c 3/08; salts of cyanic acid c01c 3/14; salts of cyanamide c01c 3/16; thiocyanates c01c 3/20; ); compounds containing metals not covered by subclasses c01d or c01f  c01b 6/00; salts of oxyacids of halogens c01b 11/00; peroxides, salts or peroxyacids c01b 15/00; thiosulfates, dithionites, polythionates c01b 17/64; compounds containing selenium, or tellurium c01b 19/00; binary compounds of nitrogen with metals c01b 21/06; azides c01b 21/08; ; metal amides c01b 21/092; nitrites c01b 21/50; ; phosphides c01b 25/08; salts of oxyacids of phosphorus c01b 25/16; carbides c01b 32/90; compounds containing silicon c01b 33/00; compounds containing boron c01b 35/00; compounds having molecular sieve properties but not having base-exchange properties c01b 37/00; compounds having molecular sieve and base-exchange properties, e.g. crystalline zeolites, c01b 39/00; cyanides c01c 3/08; salts of cyanamide c01c 3/16; thiocyanates c01c 3/20); indexing scheme relating to structural and physical aspects of solid inorganic compounds",{'C01'}
C02,"treatment of water, waste water, sewage, or sludge; treatment of water, waste water, sewage, or sludge ","{'B01', 'C23', 'B63', 'G21'}"
C03,"glass; mineral or slag wool; manufacture, shaping, or supplementary processes; chemical composition of glasses, glazes or vitreous enamels; surface treatment of glass; surface treatment of fibres or filaments made from glass, minerals or slags; joining glass to glass or other materials",set()
C04,"cements; concrete; artificial stone; ceramics; refractories; lime, magnesia; slag; cements; compositions thereof, e.g. mortars, concrete or like building materials; artificial stone }; ceramics ; refractories; treatment of natural stone","{'E04', 'C03'}"
C05,"fertilisers; manufacture thereof; phosphatic fertilisers; nitrogenous fertilisers; inorganic fertilisers not covered by subclasses c05b, c05c; fertilisers producing carbon dioxide; organic fertilisers not covered by subclasses c05b, c05c, e.g. fertilisers from waste or refuse }; mixtures of fertilisers covered individually by different subclasses of class c05; mixtures of one or more fertilisers with materials not having a specific fertilising activity, e.g. pesticides, soil-conditioners, wetting agents ; fertilisers characterised by their form","{'C05', 'A01'}"
C06,explosives; matches; explosives or thermic compositions ; manufacture thereof; use of single substances as explosives ); detonating or priming devices; fuses ; chemical lighters; pyrophoric compositions; means for generating smoke or mist; gas-attack compositions; generation of gas for blasting or propulsion  ; matches; manufacture of matches,"{'C08', 'F42', 'C01', 'C04', 'C07', 'C10'}"
C07,"organic chemistry; general methods of organic chemistry; apparatus therefor ; acyclic or carbocyclic compounds; heterocyclic compounds; acyclic, carbocyclic or heterocyclic compounds containing elements other than carbon, hydrogen, halogen, oxygen, nitrogen, sulfur, selenium or tellurium ; compounds of unknown constitution; sugars; derivatives thereof; nucleosides; nucleotides; nucleic acids ; steroids ; peptides ","{'C08', 'C12', 'A61', 'A23', 'G01', 'C09', 'C07', 'C13'}"
C08,"organic macromolecular compounds; their preparation or chemical working-up; compositions based thereon; polysaccharides; derivatives thereof ; treatment or chemical modification of rubbers; macromolecular compounds obtained by reactions only involving carbon-to-carbon unsaturated bonds; macromolecular compounds obtained otherwise than by reactions only involving unsaturated carbon-to-carbon bonds; derivatives of natural macromolecular compounds ; working-up; general processes of compounding; after-treatment not covered by subclasses c08b, c08c, c08f, c08g or c08h ; use of inorganic or non-macromolecular organic substances as compounding ingredients ; compositions of macromolecular compounds ","{'C08', 'C12', 'D21', 'D01', 'C10', 'B29', 'D06', 'C09', 'C07', 'C13'}"
C09,"dyes; paints; polishes; natural resins; adhesives; compositions not otherwise provided for; applications of materials not otherwise provided for; organic dyes or closely-related compounds for producing dyes ; mordants; lakes ; treatment of inorganic materials, other than fibrous fillers, to enhance their pigmenting or filling properties ; preparation of carbon black; ; coating compositions, e.g. paints, varnishes or lacquers; filling pastes; chemical paint or ink removers; inks; correcting fluids; woodstains; pastes or solids for colouring or printing; use of materials therefor ; natural resins; french polish; drying-oils; driers ; turpentine; polishing compositions ; ski waxes; preparation of glue or gelatine; adhesives; non-mechanical aspects of adhesive processes in general; adhesive processes not provided for elsewhere; use of materials as adhesives ; materials for miscellaneous applications, not provided for elsewhere","{'C12', 'A61', 'C04', 'C25', 'C03', 'C09', 'B27', 'B05', 'C01'}"
C10,"petroleum, gas or coke industries; technical gases containing carbon monoxide; fuels; lubricants; peat; destructive distillation of carbonageous materials for production of gas, coke, tar, or similar materials ; working-up pitch, asphalt, bitumen, tar; pyroligneous acid ; drying or working-up of peat; cracking hydrocarbon oils; production of liquid hydrocarbon mixtures, e.g. by destructive hydrogenation, oligomerisation, polymerisation ; recovery of hydrocarbon oils from oil-shale, oil-sand, or gases; refining mixtures mainly consisting of hydrocarbons; reforming of naphtha; mineral waxes ; production of acetylene by wet methods }; production of producer gas, water-gas, synthesis gas from solid carbonaceous material, or mixtures containing these gases ; carburetting air or other gases; purifying or modifying the chemical composition of combustible gases containing carbon monoxide; fuels not otherwise provided for ; natural gas; synthetic natural gas obtained by processes not covered by subclasses c10g, c10k; liquefied petroleum gas; adding materials to fuels or fires to reduce smoke or undesirable deposits or to facilitate soot removal; firelighters; lubricating compositions ; use of chemical substances either alone or as lubricating ingredients in a lubricating composition  ; mould release, i.e. separating, agents for metals b22c 3/00, for plastics or substances in a plastic state, in general b29c 33/56, for glass c03b 40/02; use of particular substances in particular apparatus or conditions, see f16n or the relevant groups for the application, e.g. a21d 8/08, b21c 9/00, h01b 3/18; immersion oils for microscopy g02b 21/33); indexing scheme associated with subclass c10m relating to lubricating compositions","{'C08', 'A61', 'D01', 'C03', 'B21', 'F16', 'E21', 'A21', 'C01', 'G21', 'C10', 'C06', 'B29', 'H01', 'C11', 'C09', 'C07', 'B22', 'C23', 'G02'}"
C11,"animal or vegetable oils, fats, fatty substances or waxes; fatty acids therefrom; detergents; candles; producing, e.g. by pressing raw materials or by extraction from waste materials, refining or preserving fats, fatty substances, e.g. lanolin, fatty oils or waxes; essential oils; perfumes ; fatty acids from fats, oils or waxes; candles; fats, oils or fatty acids by chemical modification of fats, oils, or fatty acids obtained therefrom; detergent compositions ; use of single substances as detergents; soap or soap-making; resin soaps; recovery of glycerol","{'A61', 'B01', 'C09'}"
C12,"biochemistry; beer; spirits; wine; vinegar; microbiology; enzymology; mutation or genetic engineering; beer; preparation of beer by fermentation ; preparation of malt for making beer; preparation of hops for making beer; recovery of by-products of fermented solutions ; denatured alcohol; preparation thereof; wine; preparation thereof; alcoholic beverages ; preparation of alcoholic beverages not provided for in subclasses c12c or c12h; pasteurisation, sterilisation, preservation, purification, clarification or ageing of alcoholic beverages; methods for altering the alcohol content of fermented solutions or alcoholic beverages ; vinegar; preparation or purification thereof; pitching or depitching machines; cellar tools ; apparatus for enzymology or microbiology; ; microorganisms or enzymes; compositions thereof; propagating, preserving, or maintaining microorganisms; mutation or genetic engineering; culture media ; fermentation or enzyme-using processes to synthesise a desired chemical compound or composition or to separate optical isomers from a racemic mixture }; measuring or testing processes involving enzymes, nucleic acids or microorganisms ; compositions or test papers therefor; processes of preparing such compositions; condition-responsive control in microbiological or enzymological processes; indexing scheme associated with subclasses c12c - c12q, relating to microorganisms; enzymes","{'B08', 'C12', 'A23', 'A21', 'C07', 'C01', 'G01'}"
C13,"sugar industry; production of sucrose; apparatus specially adapted therefor ; saccharides obtained from natural sources or by hydrolysis of naturally occurring disaccharides, oligosaccharides or polysaccharides ","{'C08', 'C12', 'C07', 'C13'}"
C14,"skins; hides; pelts; leather; mechanical treatment or processing of skins, hides or leather in general; pelt-shearing machines; intestine-splitting machines ; chemical treatment of hides, skins or leather, e.g. tanning, impregnating, finishing; apparatus therefor; compositions for tanning ","{'B68', 'D06', 'B29'}"
C21,"metallurgy of iron; manufacture of iron or steel ; processing of pig-iron, e.g. refining, manufacture of wrought-iron or steel; treatment in molten state of ferrous alloys ; modifying the physical structure of ferrous metals; general devices for heat treatment of ferrous or non-ferrous metals or alloys; making metal malleable, e.g. by decarburisation or tempering ","{'H05', 'C22', 'C23', 'C30'}"
C22,metallurgy; ferrous or non-ferrous alloys; treatment of alloys or non-ferrous metals; production and refining of metals ; pretreatment of raw materials; alloys ; changing the physical structure of non-ferrous metals and non-ferrous alloys ,"{'C21', 'C25', 'C22', 'C23', 'C06'}"
C23,"coating metallic material; coating material with metallic material; chemical surface treatment; diffusion treatment of metallic material; coating by vacuum evaporation, by sputtering, by ion implantation or by chemical vapour deposition, in general; inhibiting corrosion of metallic material or incrustation in general; coating metallic material; coating material with metallic material; surface treatment of metallic material by diffusion into the surface, by chemical conversion or substitution; coating by vacuum evaporation, by sputtering, by ion implantation or by chemical vapour deposition, in general ; enamelling of, or applying a vitreous layer to, metals ; non-mechanical removal of metallic material from surface ; inhibiting corrosion of metallic material or incrustation in general; multi-step processes for surface treatment of metallic material involving at least one process provided for in class c23 and at least one process covered by subclass c21d or c22f or class c25; cleaning or degreasing of metallic material by chemical methods other than electrolysis ","{'C04', 'C25', 'B44', 'C30', 'C09', 'C03', 'B23', 'D06', 'C21', 'C11', 'B21', 'C22', 'C23'}"
C25,"electrolytic or electrophoretic processes; apparatus therefor; electrolytic or electrophoretic processes for the production of compounds or non-metals; apparatus therefor ; processes for the electrolytic production, recovery or refining of metals; apparatus therefor; processes for the electrolytic or electrophoretic production of coatings; electroforming; apparatus therefor; processes for the electrolytic removal of materials from objects; apparatus therefor","{'C30', 'C23'}"
C30,crystal growth; single-crystal growth ; unidirectional solidification of eutectic material or unidirectional demixing of eutectoid material; refining by zone-melting of material ; production of a homogeneous polycrystalline material with defined structure ; single crystals or homogeneous polycrystalline material with defined structure; after-treatment of single crystals or a homogeneous polycrystalline material with defined structure ; apparatus therefor,"{'B29', 'C21', 'H01', 'B22', 'C22', 'B01'}"
C40,"combinatorial technology; combinatorial chemistry; libraries, e.g. chemical libraries ",{'G16'}
C99,subject matter not otherwise provided for in this section; subject matter not otherwise provided for in this section,set()
D01,"natural or man-made threads or fibres; spinning; mechanical treatment of natural fibrous or filamentary material to obtain fibres of filaments, e.g. for spinning ; chemical treatment of natural filamentary or fibrous material to obtain filaments or fibres for spinning; carbonising rags to recover animal fibres; mechanical methods or apparatus in the manufacture of artificial filaments, threads, fibres, bristles or ribbons; chemical features in the manufacture of artificial filaments, threads, fibres, bristles or ribbons; apparatus specially adapted for the manufacture of carbon filaments; preliminary treatment of fibres, e.g. for spinning ; spinning or twisting ","{'D21', 'B03', 'B65', 'D01', 'D02'}"
D02,"yarns; mechanical finishing of yarns or ropes; warping or beaming; crimping or curling fibres, filaments, threads, or yarns; yarns or threads; warping, beaming or leasing; finishing or dressing of filaments, yarns, threads, cords, ropes or the like ","{'D02', 'D06', 'D07'}"
D03,weaving; shedding mechanisms; pattern cards or chains; punching of cards; designing patterns; woven fabrics; methods of weaving; looms; auxiliary weaving apparatus; weavers' tools; shuttles,set()
D04,"braiding; lace-making; knitting; trimmings; non-woven fabrics; knitting; braiding or manufacture of lace, including bobbin-net or carbonised lace; braiding machines; braid; lace ; trimmings; ribbons, tapes or bands, not otherwise provided for ; making nets by knotting of filamentary material; making knotted carpets or tapestries; knotting not otherwise provided for ; making textile fabrics, e.g. from fibres or filamentary material ; fabrics made by such processes or apparatus, e.g. felts, non-woven fabrics; cotton-wool; wadding ","{'D03', 'B27', 'D05', 'B32', 'A42', 'D06', 'A43', 'D02', 'B65', 'B21', 'B44', 'A01', 'D04'}"
