context,description,mentioned_groups
D05,"sewing; embroidering; tufting; sewing ; embroidering; tufting ; indexing scheme associated with subclasses d05b and d05c, relating to sewing, embroidering and tufting","{'A41', 'B42', 'A47', 'D05', 'D04'}"
D06,"treatment of textiles or the like; laundering; flexible materials not otherwise provided for; treating textile materials using liquids, gases or vapours ; finishing, dressing, tentering or stretching textile fabrics; laundering, drying, ironing, pressing or folding textile articles; mechanical or pressure cleaning of carpets, rugs, sacks, hides, or other skin or textile articles or fabrics; turning inside-out flexible tubular or other hollow articles; marking, inspecting, seaming or severing textile materials ; pleating, kilting or goffering textile fabrics or wearing apparel  by sewing d05b); dry-cleaning, washing or bleaching fibres, filaments, threads, yarns, fabrics, feathers or made-up fibrous goods; bleaching leather or furs; treatment, not provided for elsewhere in class d06, of fibres, threads, yarns, fabrics, feathers or fibrous goods made from such materials; wall, floor, or like covering materials, e.g. linoleum, oilcloth, artificial leather, roofing felt, consisting of a fibrous web coated with a layer of macromolecular material; flexible sheet material not otherwise provided for; dyeing or printing textiles; dyeing leather, furs or solid macromolecular substances in any form; decorating textiles ","{'D06', 'B31', 'D01', 'D05'}"
D07,"ropes; cables other than electric; ropes or cables in general ; mechanical finishing or dressing of ropes d02j; ; decorative ropes or cords d04d; suspension cables for bridges e01d 19/16; specially adapted for driving, or for being driven by, pulleys or other gearing elements f16g 9/00; electric cables or joints insofar as electrical aspects are essential h01b, h01r)","{'A63', 'H01', 'E01', 'D02', 'B65', 'F16', 'D04'}"
D10,"indexing scheme associated with sublasses of section d, relating to textiles; indexing scheme associated with sublasses of section d, relating to textiles",set()
D21,paper-making; production of cellulose; fibrous raw materials or their mechanical treatment; production of cellulose by removing non-cellulose substances from cellulose-containing materials; regeneration of pulping liquors; apparatus therefor; treatment of the materials before passing to the paper-making machine; paper-making machines; methods of producing paper thereon; calenders; accessories for paper-making machines ; pulp compositions; preparation thereof not covered by subclasses d21c or d21d; impregnating or coating of paper; treatment of finished paper not covered by class b31 or subclass d21g; paper not otherwise provided for; fibreboard; manufacture of articles from cellulosic fibrous suspensions or from papier-mache ,"{'B27', 'B65', 'D21', 'B31'}"
D99,subject matter not otherwise provided for in this section; subject matter not otherwise provided for in this section,set()
E01,"construction of roads, railways, or bridges; permanent way; permanent-way tools; machines for making railways of all kinds ; construction of, or surfaces for, roads, sports grounds, or the like; machines or auxiliary tools for construction or repair ; construction of bridges,  or viaducts; assembly of bridges ); additional work, such as equipping roads or the construction of platforms, helicopter landing stages, signs, snow fences, or the like; street cleaning; cleaning of permanent ways; cleaning beaches; dispersing  fog in general ","{'B08', 'B64', 'B61', 'E01'}"
E02,hydraulic engineering; foundations; soil shifting; hydraulic engineering ; ship-lifting devices or mechanisms; foundations; excavations; embankments ; underground or underwater structures }; dredging; soil-shifting ,"{'E02', 'E21'}"
E03,"water supply; sewerage; installations or methods for obtaining, collecting, or distributing water ; domestic plumbing installations for fresh water or waste water ; sinks; water-closets or urinals with flushing devices; flushing valves therefor; sewers; cesspools","{'A47', 'E03', 'F17', 'E21'}"
E04,"building; general building constructions; walls, e.g. partitions; roofs; floors; ceilings; insulation or other protection of buildings ); structural elements; building materials ; roof coverings; sky-lights; gutters; roof-working tools ; finishing work on buildings, e.g. stairs, floors ; scaffolding; forms; shuttering; building implements or aids, or their use; handling building materials on the site; repairing, breaking-up or other work on existing buildings; buildings or like structures for particular purposes; swimming or splash baths or pools; masts; fencing; tents or canopies, in general ","{'H05', 'E04', 'E01', 'E06', 'E02', 'F16', 'E21'}"
E05,"locks; keys; window or door fittings; safes; locks; accessories therefor; handcuffs; bolts or fastening devices for wings, specially for doors or windows ; fastening devices for constructional or engineering elements e04, f16b; locks, fastening devices structurally or operatively combined or having significant cooperation with locks e05b; means for operating or controlling wing fasteners in conjunction with mechanisms for moving the wing e05f); hinges or suspension devices for doors, windows or wings ; devices for moving wings into open or closed position; checks for wings; wing fittings not otherwise provided for, concerned with the functioning of the wing; safes or strong-rooms for valuables; bank protection devices; safety transaction partitions  alarm arrangements per se g08b); indexing scheme relating to hinges or other suspension devices for doors, windows or wings and devices for moving wings into open or closed position, checks for wings and wing fittings not otherwise provided for, concerned with the functioning of the wing","{'E05', 'A45', 'E04', 'G08', 'F16', 'B62'}"
E06,"doors, windows, shutters, or roller blinds in general; ladders; fixed or movable closures for openings in buildings, vehicles, fences or like enclosures in general, e.g. doors, windows, blinds, gates ; ladders ","{'B64', 'B62', 'E04', 'B63', 'A47', 'A01'}"
E21,"earth drilling; mining; earth drilling, e.g. deep drilling ; obtaining oil, gas, water, soluble or meltable materials or a slurry of minerals from wells; mining or quarrying; shafts; tunnels; galleries; large underground chambers ; safety devices, transport, filling-up, rescue, ventilation, or draining in or of mines or tunnels","{'E21', 'C09'}"
E99,subject matter not otherwise provided for in this section; subject matter not otherwise provided for in this section,set()
F01,"machines or engines in general; engine plants in general; steam engines; machines or engines, in general or of positive-displacement type, e.g. steam engines ; rotary-piston or oscillating-piston machines or engines ; non-positive displacement machines or engines, e.g. steam turbines ; steam engine plants; steam accumulators; engine plants not otherwise provided for; engines using special working fluids or cycles ; cyclically operating valves for machines or engines; lubricating of machines or engines in general; lubricating internal combustion engines; crankcase ventilating; gas-flow silencers or exhaust apparatus for machines or engines in general; gas-flow silencers or exhaust apparatus for internal combustion engines  ; arrangements in connection with gas exhaust of propulsion units in vehicles b60k 13/00,  ; combustion-air intake silencers specially adapted for, or arranged on, internal-combustion engines f02m 35/00;  ; protecting against, or damping, noise in general g10k 11/16); cooling of machines or engines in general; cooling of internal-combustion engines ; heat exchange in general, radiators f28)","{'B64', 'F41', 'B08', 'B63', 'F16', 'F01', 'F02', 'F23', 'G21', 'B60', 'B25', 'F28', 'F03', 'F04', 'F24', 'C09', 'G10'}"
F02,"combustion engines; hot-gas or combustion-product engine plants; internal-combustion piston engines; combustion engines in general ; gas-turbine plants; air intakes for jet-propulsion plants; controlling fuel supply in air-breathing jet-propulsion plants ; controlling combustion engines ; cylinders, pistons or casings, for combustion engines; arrangements of sealings in combustion engines; hot gas or combustion-product positive-displacement engine plants ; use of waste heat of combustion engines; not otherwise provided for; jet-propulsion plants ; supplying combustion engines in general with combustible mixtures or constituents thereof; starting of combustion engines; starting aids for such engines, not otherwise provided for; ignition, other than compression ignition, for internal-combustion engines; testing of ignition timing in compression-ignition engines ; specially adapted for rotary-piston or oscillating-piston engines f02b 53/12; ; ignition of combustion apparatus in general, glowing plugs f23q; measuring of physical variables in general g01; controlling in general g05; data processing in general g06; electrical components in general see section h; ; sparking plugs h01t 13/00)","{'F02', 'F23', 'B60', 'G05', 'H01', 'F04', 'F25', 'F01', 'G01', 'G06'}"
F03,"machines or engines for liquids; wind, spring, or weight motors; producing mechanical power or a reactive propulsive thrust, not otherwise provided for; machines or engines for liquids ; positive-displacement engines driven by liquids ; wind motors; spring, weight, inertia or like motors; mechanical-power producing devices or mechanisms, not otherwise provided for or using energy sources not otherwise provided for ; producing a reactive propulsive thrust, not otherwise provided for ","{'F02', 'B60', 'F03', 'F04', 'F15', 'F16', 'F01'}"
F04,"positive - displacement machines for liquids; pumps for liquids or elastic fluids; positive-displacement machines for liquids; pumps ; rotary-piston, or oscillating-piston, positive-displacement machines for liquids ; rotary-piston, or oscillating-piston, positive-displacement pumps; non-positive-displacement pumps ; pumping of fluid by direct contact of another fluid or by using inertia of fluid to be pumped }; siphons }","{'F03', 'H01', 'F04', 'F02', 'H02', 'B65'}"
F05,"indexing schemes relating to engines or pumps in various subclasses of classes f01-f04; indexing scheme relating to wind, spring, weight, inertia or like motors, to machines or engines for liquids covered by subclasses f03b, f03d and f03g; indexing scheme relating to materials, material properties or material characteristics for machines, engines or pumps other than non-positive-displacement machines or engines; indexing scheme for aspects relating to non-positive-displacement machines or engines, gas-turbines or jet-propulsion plants","{'F03', 'F01', 'F04'}"
F15,"fluid-pressure actuators; hydraulics or pneumatics in general; systems acting by means of fluids in general; fluid-pressure actuators, e.g. servomotors; details of fluid-pressure systems, not otherwise provided for; fluid-circuit elements predominantly used for computing or control purposes ; fluid dynamics in general f15d; computer comprising fluid elements g06d, g06g; ); fluid dynamics, i.e. methods or means for influencing the flow of gases or liquids ; fluid circuit elements f15c; )","{'E02', 'C10', 'B05', 'G05', 'B63', 'C09', 'F15', 'F16', 'G06'}"
F16,"engineering elements and units; general measures for producing and maintaining effective functioning of machines or installations; thermal insulation in general; devices for fastening or securing constructional elements or machine parts together, e.g. nails, bolts, circlips, clamps, clips, wedges, joints or jointing ; shafts; flexible shafts; elements or crankshaft mechanisms; rotary bodies other than gearing elements; bearings; couplings for transmitting rotation; clutches; brakes; springs; shock-absorbers; means for damping vibration; belts, cables, or ropes, predominantly used for driving purposes; chains; fittings predominantly used therefor; gearing; pistons }; cylinders; sealings; valves; taps; cocks; actuating-floats; devices for venting or aerating }; pipes; joints or fittings for pipes; supports for pipes, cables or protective tubing; means for thermal insulation in general; frames, casings or beds of engines, machines or apparatus, not specific to engines, machines or apparatus provided for elsewhere; stands; supports; lubricating; safety devices in general; ; constructional elements in general; structures built-up from such elements, in general; steam traps or like apparatus for draining-off liquids from enclosures predominantly containing gases or vapours",{'F16'}
F17,"storing or distributing gases or liquids; gas-holders of variable capacity ; vessels for containing or storing compressed, liquefied or solidified gases; fixed-capacity gas-holders; filling vessels with, or discharging from vessels, compressed, liquefied, or solidified gases ; pipe-line systems; pipe-lines ","{'F25', 'F23', 'B65', 'F17', 'G08', 'E04', 'G05', 'F04', 'H01', 'F15', 'A47', 'F16', 'B01', 'G01', 'A62'}"
F21,"lighting; incandescent mantles; other incandescent bodies heated by combustion; non-electric light sources using luminescence; light sources using electrochemiluminescence; light sources using charges of combustible material; light sources using semiconductor devices as light-generating elements; light sources not otherwise provided for; lighting devices or systems thereof, being portable or specially adapted for transportation; non-portable lighting devices; systems thereof; vehicle lighting devices specially adapted for vehicle exteriors; functional features or details of lighting devices or systems thereof; structural combinations of lighting devices with other articles, not otherwise provided for; indexing scheme associated with subclasses f21k, f21l, f21s and f21v, relating to uses or applications of lighting devices or systems; indexing scheme associated with subclasses f21k, f21l, f21s and f21v, relating to the form or the kind of the light sources or of the colour of the light emitted",{'F21'}
F22,"steam generation; methods of steam generation; steam boilers ; preheating, or accumulating preheated, feed-water for steam generation; feed-water supply for steam generation; controlling water level for steam generation; auxiliary devices for promoting water circulation within steam boilers; superheating of steam ","{'F24', 'F22', 'G21', 'F01', 'F28'}"
F23,"combustion apparatus; combustion processes; methods or apparatus for combustion using only solid fuel ; methods or apparatus for combustion using fluid fuel or solid fuel suspended in   air  ; burners; cremation furnaces; consuming waste products by combustion; grates ; cleaning or raking grates; removal or treatment of combustion products or combustion residues; flues  ; feeding fuel to combustion apparatus ; supplying air or non-combustible liquids or gases to combustion apparatus in general   firebridges with means for feeding air or steam f23m 3/04; baffles or shields with air supply passages f23m 9/04); valves or dampers specially adapted for controlling air supply or draught in combustion apparatus }; inducing draught in combustion apparatus; tops for chimneys or ventilating shafts; terminals for flues; casings, linings, walls or doors specially adapted for combustion chambers, e.g. firebridges; devices for deflecting air, flames or combustion products in combustion chambers; safety arrangements specially adapted for combustion apparatus; details of combustion chambers, not otherwise provided for; regulating or controlling combustion ; ignition ; extinguishing-devices; generating combustion products of high pressure or high velocity, e.g. gas-turbine combustion chambers ","{'A24', 'F24', 'C11', 'F23', 'F02', 'C06'}"
F24,"heating; ranges; ventilating; domestic stoves or ranges for solid fuels ; implements for use in connection with stoves or ranges; domestic stoves or ranges  ; details of domestic stoves or ranges, of general application; domestic- or space-heating systems, e.g. central heating systems; domestic hot-water supply systems; elements or components therefor ; air-conditioning; air-humidification; ventilation; use of air currents for screening ; fluid heaters, e.g. water or air heaters, having heat-generating means, e.g. heat pumps, in general ; solar heat collectors; solar heat systems ; geothermal collectors; geothermal systems; collection, production or use of heat not otherwise provided for","{'B08', 'F03', 'E04', 'F24', 'F23', 'F22', 'F01'}"
F25,"refrigeration or cooling; combined heating and refrigeration systems; heat pump systems; manufacture or storage of ice; liquefaction solidification of gases; refrigeration machines, plants or systems; combined heating and refrigeration systems; heat pump systems; producing, working or handling ice; refrigerators; cold rooms; ice-boxes; cooling or freezing apparatus not otherwise provided for ; liquefaction, solidification or separation of gases or gaseous  mixtures by pressure and cold treatment }","{'B64', 'G12', 'B65', 'F17', 'B60', 'F24', 'F04', 'C09', 'A47', 'F25'}"
F26,"drying; drying solid materials or objects by removing liquid therefrom  drying gases and vapours b01d; chemical and physical processes for dewatering or like separating liquids from solids b01d 43/00; centrifugal apparatus b04; drying ceramics c04b 33/30; drying yarns and fabrics in association with some other form of treatment d06c; drying frames for laundry without heating or positive air circulation, domestic and like spin-dryers, wringing and hot pressing laundry d06f; furnaces, kilns, ovens f27; )","{'A23', 'F27', 'C04', 'B04', 'A45', 'D06', 'H01', 'A47', 'B01', 'A01'}"
F27,"furnaces; kilns; ovens; retorts; furnaces, kilns, ovens, or retorts in general; open sintering or like apparatus; details or accessories of furnaces, kilns, ovens, or retorts, in so far as they are of kinds occurring in more than one kind of furnace ; indexing scheme relating to aspects of the charges or furnaces, kilns, ovens or retorts",{'F23'}
F28,"heat exchange in general; steam or vapour condensers ; heat-exchange apparatus, not provided for in another subclass, in which the heat-exchange media come into direct contact without chemical interaction ; heat-exchange apparatus, not provided for in another subclass, in which the heat-exchange media do not come into direct contact ; details of heat-exchange and heat-transfer apparatus, of general application ; cleaning of internal or external surfaces of heat-exchange or heat-transfer conduits, e.g. water tubes or boilers ","{'F27', 'F23', 'F28', 'B08', 'F24', 'F22', 'F16', 'F25', 'F01', 'B01'}"
F41,"weapons; functional features or details common to both smallarms and ordnance, e.g. cannons; mountings for smallarms or ordnance; weapons for projecting missiles without use of explosive or combustible propellant charge; weapons not otherwise provided for ; smallarms, e.g. pistols, rifles ; accessories therefor; apparatus for launching projectiles or missiles from barrels, e.g. cannons ; launchers for rockets or torpedoes; harpoon guns ; weapon sights; aiming ; armour; armoured turrets; armoured or armed vehicles; means of attack or defence, e.g. camouflage, in general; targets; target ranges; bullet catchers }","{'F41', 'F42', 'A63', 'B26', 'G02', 'A01'}"
F42,"ammunition; blasting; explosive charges, e.g. for blasting, fireworks, ammunition ; ammunition fuzes ; arming or safety means therefor ; blasting ; cartridges f42b 3/00)","{'F42', 'E21', 'C06'}"
F99,subject matter not otherwise provided for in this section; subject matter not otherwise provided for in this section,set()
G01,"measuring; testing; measuring length, thickness or similar linear dimensions; measuring angles; measuring areas; measuring irregularities of surfaces or contours; measuring distances, levels or bearings; surveying; navigation; gyroscopic instruments; photogrammetry or videogrammetry ; measuring not specially adapted for a specific variable; arrangements for measuring two or more variables not covered in a single other subclass; tariff metering apparatus; measuring or testing not otherwise provided for; measuring volume, volume flow, mass flow or liquid level; metering by volume; weighing ; measurement of mechanical vibrations or ultrasonic, sonic or infrasonic waves; measurement of intensity, velocity, spectral content, polarisation, phase or pulse characteristics of infra-red, visible or ultra-violet light; colorimetry; radiation pyrometry ; measuring temperature; measuring quantity of heat; thermally-sensitive elements not otherwise provided for ; measuring force, stress, torque, work, mechanical power, mechanical efficiency, or fluid pressure ; testing static or dynamic balance of machines or structures; testing of structures or apparatus, not otherwise provided for; investigating or analysing materials by determining their chemical or physical properties ; measuring linear or angular speed, acceleration, deceleration, or shock; indicating presence, absence, or direction, of movement ); scanning-probe techniques or apparatus; applications of scanning-probe techniques, e.g. scanning probe microscopy ; measuring electric variables; measuring magnetic variables ; radio direction-finding; radio navigation; determining distance or velocity by use of radio waves; locating or presence-detecting by use of the reflection or reradiation of radio waves; analogous arrangements using other waves; measurement of nuclear or x-radiation ; geophysics; gravitational measurements; detecting masses or objects; tags ; meteorology ","{'H05', 'B07', 'C12', 'F21', 'A61', 'B61', 'A63', 'H03', 'B60', 'A01', 'H01', 'E01', 'G08', 'G01'}"
G02,"optics; optical elements, systems or apparatus; spectacles; sunglasses or goggles insofar as they have the same features as spectacles; contact lenses ; optical devices or arrangements for the control of light by modification of the optical properties of the media of the elements involved therein; non-linear optics; frequency-changing of light; optical logic elements; optical analogue/digital converters",{'A61'}
G03,"photography; cinematography; analogous techniques using waves other than optical waves; electrography; holography; apparatus or arrangements for taking photographs or for projecting or viewing them; apparatus or arrangements employing analogous techniques using waves other than optical waves; accessories therefor ; photosensitive materials for photographic purposes ; photographic processes, e.g. cine, x-ray, colour, stereo-photographic processes; auxiliary processes in photography ; apparatus for processing exposed photographic materials ; accessories therefor ; photomechanical production of textured or patterned surfaces, e.g. for printing, for processing of semiconductor devices; materials therefor; originals therefor; apparatus specially adapted therefor; ; electrography; electrophotography; magnetography ; holographic processes or apparatus ; apparatus for processing exposed photographic materials g03d; analogue computers performing mathematical operations with the aid of optical elements g06e 3/00; authentication by radiation, of concealed information carried by holograms or diffraction gratings g06k 19/16; holographic storage g11b 7/0065, g11c 13/04; )","{'G03', 'H04', 'B41', 'G11', 'G02', 'G06'}"
G04,"horology; mechanically-driven clocks or watches; mechanical parts of clocks or watches in general; time pieces using the position of the sun, moon or stars ; electromechanical clocks or watches ; apparatus or tools specially designed for making or maintaining clocks or watches; time-interval measuring ); electronic time-pieces; radio-controlled time-pieces","{'F03', 'F42', 'H01', 'G04', 'H03', 'G01'}"
G05,controlling; regulating; control or regulating systems in general; functional elements of such systems; monitoring or testing arrangements for such systems or elements ; systems for controlling or regulating non-electric variables ; systems for regulating electric or magnetic variables ; control devices or systems insofar as characterised by mechanical features only ,"{'H05', 'G12', 'H02', 'H03', 'H04', 'B22', 'G05', 'H01', 'G04', 'F15', 'F16', 'G01', 'G06'}"
G06,"computing; calculating; counting; digital computers in which all the computation is effected mechanically ; digital fluid-pressure computing devices; optical computing devices; ; electric digital data processing ; analogue computers ; hybrid computing arrangements ; neural networks for image data processing g06t; analog/digital conversion, in general h03m 1/00); graphical data reading ; presentation of data; record carriers; handling record carriers; counting mechanisms; counting of objects not otherwise provided for ; computing arrangements based on specific computational models; data processing systems or methods, specially adapted for administrative, commercial, financial, managerial, supervisory or forecasting purposes; systems or methods specially adapted for administrative, commercial, financial, managerial, supervisory or forecasting purposes, not otherwise provided for; image data processing or generation, in general; image or video recognition or understanding","{'A63', 'H03', 'H04', 'G01', 'G07', 'B41', 'G11', 'G05', 'G02', 'G06'}"
G07,"checking-devices; ticket-issuing apparatus; fare-registering apparatus; franking apparatus; time or attendance registers; registering or indicating the working of machines; generating random numbers; voting or lottery apparatus; arrangements, systems or apparatus for checking not provided for elsewhere; handling of coins or valuable papers, e.g. testing, sorting by denominations, counting, dispensing, changing or depositing; coin-freed or like apparatus ); registering the receipt of cash, valuables, or tokens ","{'G07', 'G06'}"
